{
  "personal": {
    "name": "CHAKRADHAR REDDY DEVIREDDY",
    "contact": {
      "github": {
        "text": "GitHub",
        "url": "https://github.com/chakri68"
      },
      "linkedin": {
        "text": "LinkedIn",
        "url": "https://www.linkedin.com/in/chakradhar-reddy-d"
      },
      "email": {
        "text": "chakridevireddy69@gmail.com",
        "url": "mailto:chakridevireddy69@gmail.com"
      },
      "phone": {
        "text": "+91 63037 08424",
        "url": "tel:+916303708424"
      }
    }
  },
  "summary": {
    "text": "Creative and performance-driven Full‑Stack Engineer with a frontend flair, bringing 2 years of internship experience building modern, interactive, and scalable UIs using React, Next.js, Redux Toolkit, and SvelteKit. Known for migrating large codebases to TypeScript, reducing client-side bottlenecks, and crafting real-time interfaces. Passionate about frontend architecture, UI/UX polish, and developer tooling, while maintaining strong backend and DevOps foundations."
  },
  "skills": {
    "categories": [
      {
        "title": "Languages",
        "items": "Go, TypeScript, JavaScript, Java, Python, SQL, Bash"
      },
      {
        "title": "Backend",
        "items": "Node.js, Express, Fastify, NestJS, gRPC, REST, GraphQL"
      },
      {
        "title": "Frontend",
        "items": "React, Next.js, Redux Toolkit, SvelteKit, Tailwind CSS, Chakra UI, Zustand, CodeMirror, WebSockets, HTML5, CSS3, Canvas API"
      },
      {
        "title": "Databases",
        "items": "PostgreSQL, MySQL, MSSQL, Prisma ORM, Strapi CMS, Sanity, Firestore"
      },
      {
        "title": "Cloud & DevOps",
        "items": "AWS (S3, EC2, Lambda, RDS, CloudWatch), Docker, Kubernetes, Redis, Kafka, Nginx, Bazel, Gerrit, GCP (Cloud Run, Cloud Functions)"
      }
    ]
  },
  "experience": [
    {
      "company": "Even Healthcare",
      "title": "Software Development Engineer",
      "location": "Bengaluru, India",
      "period": "Nov 2025 – Present",
      "achievements": [
        "Added dashboards for monitoring stats like success rates, latency, and cost per call for AI calls reducing manual monitoring effort by 70%.",
        "Optimized core React components and layout structure, cutting load and render times by ~25% across critical care-manager pages.",
        "Delivered UX fixes for clinical report views, ensuring stable rendering of 17k+/week documents and eliminating edge cases that broke the UI.",
        "Improved frontend reliability of fulfilment flows by fixing 900+/week UI failures, enabling seamless creation of 300+/week post-hospital forms."
      ]
    },
    {
      "company": "Zomato",
      "title": "Software Development Engineer Intern",
      "location": "Gurugram, India",
      "period": "Jan 2025 – Oct 2025",
      "achievements": [],
      "positions": [
        {
          "title": "Software Development Engineer",
          "period": "July 2025 - Oct 2025",
          "achievements": [
            "Built multiple hooks for animation timings and transitions in React, improving UI responsiveness and reducing re-renders by 30%.",
            "Developed a custom React component library built adhering to design language guidelines.",
            "Designed and built a custom backend driven form builder using React, Redux Toolkit, and TypeScript, enabling dynamic form generation and validation."
          ]
        },
        {
          "title": "Software Development Intern",
          "period": "Jan 2025 - June 2025",
          "achievements": [
            "Migrated 200+ legacy JS components to TypeScript + Redux in Next.js; decreased build‑time errors 40% and boosted feature velocity 30%.",
            "Improved UI consistency and accessibility by refactoring shared components using best practices in design systems.",
            "Built interactive WebSocket-powered dashboards for real-time GPS tracking and delivery analytics.",
            "Collaborated with design team to improve UI responsiveness across devices and browsers."
          ]
        }
      ]
    },
    {
      "company": "Shinpo Engineering Pvt. Ltd.",
      "title": "Frontend-leaning Full Stack Developer Intern",
      "location": "Remote",
      "period": "Dec 2023 – Apr 2024",
      "achievements": [
        "Restructured React component hierarchy; reduced client re-renders 40%, keeping First‑Input Delay < 50 ms.",
        "Built and styled reusable frontend components with Tailwind CSS and integrated CMS-powered data with Sanity.",
        "Designed and implemented responsive layouts ensuring pixel-perfect rendering across devices."
      ]
    },
    {
      "company": "WCARL — IIIT Lucknow",
      "title": "Full‑Stack Web Developer Intern",
      "location": "Lucknow, India",
      "period": "Oct 2022 – Mar 2023",
      "achievements": [
        "Developed responsive and accessible UIs in Next.js for government tax interfaces handling 75k req/min.",
        "Created custom frontend workflows using dynamic forms and PDF generation tools (PDFMake & Mammoth).",
        "Integrated secure session handling via HTTPOnly cookies, JWT tokens, and WAF policies."
      ]
    }
  ],
  "projects": [
    {
      "name": "JScratch (VS Code Extension)",
      "description": "ETL scratchpad for data transformations using TS. Published on the VS Code Marketplace.",
      "url": "https://github.com/chakri68/jscratch"
    },
    {
      "name": "Family Vault",
      "description": "Offline-first encrypted document vault (PWA): service-worker shell, IndexedDB cache, passkey unlock, client-side AES-256-GCM.",
      "url": "https://github.com/chakri68/vault"
    },
    {
      "name": "get‑proctored.ai",
      "description": "AI‑powered proctoring frontend using TensorFlow.js, MediaPipe, and WebRTC; built responsive interfaces and live video preview layers.",
      "url": "https://github.com/chakri68/get-proctered-public"
    },
    {
      "name": "life-sim",
      "description": "Interactive cellular-automata playground (Conway's Life and beyond) in TypeScript + Canvas2D; brush painting, pan/zoom camera, live population charts, a CodeMirror rule editor, and base64 URL-shareable universes.",
      "url": "https://github.com/chakri68/life-sim"
    }
  ],
  "education": {
    "institution": "Indian Institute of Information Technology, Lucknow",
    "degree": "B.Tech. in Computer Science",
    "gpa": "9.21/10",
    "period": "Dec 2021 – Jun 2025",
    "location": "Lucknow, India"
  },
  "achievements": [
    {
      "title": "Codeforces Expert (1667)",
      "description": "Top 6% worldwide • 2024"
    },
    {
      "title": "Amazon HackOn Season 3",
      "description": "Top 50 / 5,000+ teams • 2023"
    },
    {
      "title": "Contributor, WCARL Drone",
      "description": "Featured in The Times of India • 2023"
    },
    {
      "title": "Executive Member, GDSC IIIT Lucknow",
      "description": "Organised 15+ tech events & mentored 50+ juniors • 2022–24"
    }
  ],
  "keywords": "Frontend Engineering, React, TypeScript, Next.js, Redux, SvelteKit, Tailwind CSS, WebSockets, Canvas, UI/UX, Performance Optimization, Responsive Design, JavaScript, Go, CI/CD, AWS, Kubernetes, DevTools, Developer Experience",
  "footer": {
    "copyright": "© 2026 Chakradhar Reddy Devireddy",
    "lastUpdated": "Sep 2026"
  }
}
