{
  "personal": {
    "name": "CHAKRADHAR REDDY DEVIREDDY",
    "contact": {
      "github": {
        "text": "GitHub",
        "url": "https://github.com/chakri68"
      },
      "linkedin": {
        "text": "LinkedIn",
        "url": "https://www.linkedin.com/in/chakradhar-reddy-d"
      },
      "email": {
        "text": "chakradharreddydevireddy@gmail.com",
        "url": "mailto:chakradharreddydevireddy@gmail.com"
      },
      "phone": {
        "text": "+91 63037 08424",
        "url": "tel:+916303708424"
      }
    }
  },
  "summary": {
    "text": "Backend‑leaning Full‑Stack / Platform Engineer with 2 years of internship experience building distributed, cloud‑native microservices on AWS. Proficient in Go, TypeScript/Node.js, React, PostgreSQL and container‑driven DevOps (Docker, Kubernetes, CI/CD). Designed systems processing 75 k req/min, cut P95 latency 95%, and automated pipelines that slashed deploy times 75%. Passionate about low‑latency data paths, observability, and developer‑centric tooling."
  },
  "skills": {
    "categories": [
      {
        "title": "Languages",
        "items": "Go, TypeScript, JavaScript, Java, Python, SQL, Bash"
      },
      {
        "title": "Backend / Frameworks",
        "items": "Node.js, Express, Fastify, NestJS, gRPC, REST, GraphQL"
      },
      {
        "title": "Frontend",
        "items": "React, Next.js, Redux Toolkit, SvelteKit"
      },
      {
        "title": "Cloud & DevOps",
        "items": "AWS (S3, EC2, Lambda, RDS, SQS, SNS, CloudWatch), Docker, Kubernetes, Nginx, GitHub Actions, Redis, Kafka"
      },
      {
        "title": "Databases",
        "items": "PostgreSQL, MySQL, MSSQL, Prisma ORM, Strapi CMS, Sanity"
      },
      {
        "title": "Practices",
        "items": "Distributed Systems, Microservices, Scalability, CI/CD, TDD, Agile/Scrum"
      }
    ]
  },
  "experience": [
    {
      "company": "Zomato",
      "title": "Software Development Engineer Intern",
      "location": "Gurugram, India",
      "period": "Jan 2025 – Present",
      "achievements": [],
      "positions": [
        {
          "title": "Software Development Engineer - I",
          "period": "July 2025 - Present",
          "achievements": [
            "Rolled out a new ticket workflow improving customer satisfaction with delayed orders and reducing order cancellations due to delays by 80%.",
            "Migrated internal maps to Google decreasing costs by 25%."
          ]
        },
        {
          "title": "Software Development Intern",
          "period": "Jan 2025 - June 2025",
          "achievements": [
            "Migrated 200+ legacy JS components to TypeScript + Redux in Next.js; decreased build‑time errors 40% and boosted feature velocity 30%.",
            "Authored a Go streaming SDK to pipe multi‑GB ZIP archives directly to AWS S3; reduced transfer latency 65% and halved memory overhead.",
            "Built a GPS ingestion service (≈ 50 k msgs/s) with WebSocket dashboards; improved average delivery ETA 12%.",
            "Refactored RPC layer using goroutines & gRPC batching; slashed P95 latency 95% under 2 k TPS."
          ]
        }
      ]
    },
    {
      "company": "Shinpo Engineering Pvt. Ltd.",
      "title": "Backend Developer Intern",
      "location": "Remote",
      "period": "Dec 2023 – Apr 2024",
      "achievements": [
        "Scaled Strapi‑based ERM to ~1 k RPS; in‑memory caching and query tuning lifted throughput 80%.",
        "Containerised micro‑services with Docker & AWS EC2; trimmed CI/CD duration 75% and cut infra costs 63%.",
        "Restructured React component hierarchy; reduced client re‑renders 40%, keeping First‑Input Delay < 50 ms."
      ]
    },
    {
      "company": "WCARL — IIIT Lucknow",
      "title": "Full‑Stack Web Developer Intern",
      "location": "Lucknow, India",
      "period": "Oct 2022 – Mar 2023",
      "achievements": [
        "Engineered Next.js backend for the UP Commercial Tax Dept.; sustained 75 k req/min with JWT + HTTPOnly cookies and WAF rules.",
        "Indexed MSSQL and wrote stored procedures; cut query latency 95% and CPU utilisation 90%.",
        "Automated discrepancy reports with PDFMake & Mammoth; eliminated 60% of manual formatting effort."
      ]
    }
  ],
  "projects": [
    {
      "name": "codeCollab",
      "description": "Real‑time code‑sharing IDE (Next.js, WebSockets, CodeMirror); syncs 20+ concurrent users with operational‑transform logic.",
      "url": "https://github.com/chakri68/codeCollab"
    },
    {
      "name": "get‑proctored.ai",
      "description": "AI‑powered exam proctoring (TensorFlow, MediaPipe, WebRTC); cut false‑positive rate 30%.",
      "url": "https://github.com/chakri68/get-proctered-public"
    },
    {
      "name": "TS‑ML Algorithms",
      "description": "TypeScript library of classic ML & search algorithms (K‑Means, GA, A*).",
      "url": "https://github.com/chakri68/machine-learning-algos"
    },
    {
      "name": "Pixel Drawing Simulator",
      "description": "Canvas tool showcasing Bresenham, flood‑fill, and CRUD export; built for graphics coursework and still a personal favourite.",
      "url": "https://github.com/chakri68/pixel-drawing-sim"
    }
  ],
  "education": {
    "institution": "Indian Institute of Information Technology, Lucknow",
    "degree": "B.Tech. in Computer Science",
    "gpa": "9.21/10",
    "period": "Dec 2021 – Jun 2025",
    "location": "Lucknow, India"
  },
  "achievements": [
    {
      "title": "Codeforces Expert (1667)",
      "description": "Top 6% worldwide • 2024"
    },
    {
      "title": "Amazon HackOn Season 3",
      "description": "Top 50 / 5,000+ teams • 2023"
    },
    {
      "title": "Contributor, WCARL Drone",
      "description": "Featured in The Times of India • 2023"
    },
    {
      "title": "Executive Member, GDSC IIIT Lucknow",
      "description": "Organised 15+ tech events & mentored 50+ juniors • 2022–24"
    }
  ],
  "keywords": "Distributed Systems, Microservices, Cloud‑Native, AWS, Kubernetes, Docker, REST, gRPC, SQL, PostgreSQL, Go, TypeScript, React, CI/CD, Observability, Scalability, Agile",
  "footer": {
    "copyright": "© 2025 Chakradhar Reddy Devireddy",
    "lastUpdated": "August 2025"
  }
}
